{
  "schema_version": "biomedpilot.analysis.module_input.v1",
  "module_id": "correlation",
  "mode": "mock",
  "task_id": "correlation-mock-fixture",
  "project_id": "analysis-fixture",
  "inputs": {
    "input_package_id": "fixture-correlation-input",
    "source_dataset_id": "fixture-correlation-dataset",
    "fixture_table": "analysis/fixtures/outputs/correlation/mock_result_package/tables/mock_correlation_summary.tsv"
  },
  "parameters": {
    "analysis_family": "expression_correlation",
    "method": "mock_pearson",
    "target_gene": "TP53"
  },
  "runtime": {
    "random_seed": 7,
    "requested_environment": "app-dev"
  }
}
