{
  "schema_version": "biomedpilot.analysis.module_input.v1",
  "module_id": "docking",
  "mode": "lite",
  "task_id": "docking-lite-fixture",
  "project_id": "analysis-fixture",
  "inputs": {
    "input_package_id": "fixture-docking-lite-input",
    "source_dataset_id": "fixture-docking-lite-dataset",
    "receptor_path": "analysis/fixtures/inputs/docking/lite_receptor.pdbqt",
    "ligand_path": "analysis/fixtures/inputs/docking/lite_ligand.pdbqt",
    "config_path": "analysis/fixtures/inputs/docking/lite_vina_config.txt"
  },
  "parameters": {
    "analysis_family": "molecular_docking",
    "adapter_contract": "autodock_vina_command_manifest_only",
    "external_tool": "AutoDock Vina",
    "execute_external_tool": false,
    "scientific_result_policy": "not_generated_in_lite_mode"
  },
  "runtime": {
    "random_seed": 7,
    "requested_environment": "r-chem-lite-contract"
  }
}
