{
  "schema_version": "biomedpilot.analysis.module_input.v1",
  "module_id": "spatial_transcriptomics",
  "mode": "lite",
  "task_id": "spatial-transcriptomics-lite-fixture",
  "project_id": "analysis-fixture",
  "inputs": {
    "input_package_id": "fixture-spatial-lite-input",
    "source_dataset_id": "fixture-spatial-lite-dataset",
    "expression_matrix_path": "analysis/fixtures/inputs/spatial_transcriptomics/lite_expression.tsv",
    "coordinate_table_path": "analysis/fixtures/inputs/spatial_transcriptomics/lite_coordinates.tsv"
  },
  "parameters": {
    "analysis_family": "spatial_transcriptomics",
    "method": "base_r_spot_qc_fixture",
    "execute_heavy_spatial_methods": false,
    "spatial_interpretation_policy": "not_generated_in_lite_mode"
  },
  "runtime": {
    "random_seed": 7,
    "requested_environment": "r-spatial-lite-contract"
  }
}
