{
  "schema_version": "biomedpilot.analysis.module_input.v1",
  "module_id": "survival",
  "mode": "mock",
  "task_id": "mock-task-001",
  "project_id": "mock-project",
  "inputs": {
    "fixture_matrix": "analysis/fixtures/inputs/mock_analysis_input.json"
  },
  "parameters": {
    "comparison": "mock_case_vs_control"
  },
  "runtime": {
    "random_seed": 1,
    "requested_environment": "app-dev"
  }
}
