{
  "schema_version": "biomedpilot.analysis.module_input.v1",
  "module_id": "spatial_transcriptomics",
  "mode": "mock",
  "task_id": "spatial-transcriptomics-mock-fixture",
  "project_id": "analysis-fixture",
  "inputs": {
    "input_package_id": "fixture-spatial-input",
    "source_dataset_id": "fixture-spatial-dataset",
    "fixture_table": "analysis/fixtures/outputs/spatial_transcriptomics/mock_result_package/tables/mock_summary.tsv"
  },
  "parameters": {
    "analysis_family": "spatial_transcriptomics",
    "platform": "mock_spatial"
  },
  "runtime": {
    "random_seed": 7,
    "requested_environment": "app-dev"
  }
}
