{
  "schema_version": "biomedpilot.analysis.module_input.v1",
  "module_id": "survival",
  "mode": "lite",
  "task_id": "survival-lite-fixture",
  "project_id": "analysis-fixture",
  "inputs": {
    "input_package_id": "fixture-survival-lite-input",
    "source_dataset_id": "fixture-survival-lite-dataset",
    "survival_table_path": "analysis/fixtures/inputs/survival/lite_survival.tsv"
  },
  "parameters": {
    "analysis_family": "survival",
    "method": "base_r_km_logrank",
    "time_column": "time",
    "event_column": "event",
    "group_column": "group",
    "clinical_conclusion_policy": "not_generated"
  },
  "runtime": {
    "random_seed": 7,
    "requested_environment": "r-bio-core-lite"
  }
}
